A1: te xte | B1: éà^êï
A2: ‮fusion de 4 cellues… et un long texte
A4: hauteur de ligne | C4: largeur de colonne
A5: chiffre | B5: 10.9 | C5: 10.9
A6: date | B6: 36599 | C6: 36599
A7: monnaie | B7: 10000.35 | C7: -9990.78
A8: 0.44131944444444443 | B8: petit bord
A10: large bord
A11: 1.000000 | B11: 2 | C11: 3
A12: 4 | B12: 5 | C12: 6
A13: 7 | B13: 8 | C13: 9
A14: 10 | B14: 11 | C14: 12
A16: somme | B16: =SUM(A11:A14,B11:B14) -> 48.000000
A17: nb | B17: =COUNT(C11:C15) -> 4
A18: max | B18: =MAX(A11:C14) -> 12.000000
A19: moyenne | B19: =AVERAGE(A11:C11) -> 2.000000
A20: si | B20: =IF(A11+B11 = C11,"3 est la somme","3 n'est pas la somme") -> 3 est la somme
A21: sin | B21: =SIN(A12) -> -0.7568024953079282
A22: grande.valeur | B22: =LARGE(A11:C14,1) +LARGE(A11:C14,2) -> 23.000000
A23: =ABS(-10) -> 10 | B23: =RAND() -> 0.12304122702370779 | C23: =COS(90) -> -0.44807361612917013
A24: =DEGREES(8) -> 458.36623610465858 | B24: =INT(90.9) -> 90 | C24: =AND(TRUE,TRUE,FALSE) -> FAUX
A25: =EXP(9) -> 8103.0839275753842 | B25: =LN(99) -> 4.5951198501345898 | C25: =LOG(100,10) -> 2
A26: =MOD(10,3) -> 1 | B26: =OR(TRUE,FALSE) -> VRAI | C26: =SMALL(A11:C14,3) -> 3
A27: =PI() -> 3.1415926535897931 | B27: =PRODUCT(A11:C11) -> 6 | C27: =POWER(3,2) -> 9
A28: =SQRT(9) -> 3 | B28: =RADIANS(45) -> 0.78539816339744828 | C28: =TAN(9) -> -0.45231565944180985
A29: =TRUE() -> VRAI | B29: =FALSE() -> FAUX